{
 "apricity_manifest": 2,
 "source": {
  "path": "The-band-festival-at-Plum-Center_00694075_002_00-02-43.wav",
  "sha256": "626a824ba721e44a3e2d1f8dcd1a2dee3c60bcee554dc996c4d8f6b40f95d087",
  "sample_rate": 48000,
  "channels": 2,
  "duration": 14.397
 },
 "analysis": {
  "analyzed_at": "2026-09-23T23:22:57+00:00",
  "tools": {
   "apricity-analyze": "0.2.0",
   "essentia": "2.1b6.dev1389",
   "beat_this": "final0",
   "librosa": "1.0.0 (HPSS margin 2.0 before chroma)"
  }
 },
 "rhythm": {
  "bpm": 70.59,
  "bpm_stability": 0.4,
  "beats": [
   0.04,
   0.84,
   1.64,
   2.46,
   4.88,
   5.92,
   6.72,
   6.84,
   7.66,
   7.78,
   8.66,
   9.58,
   10.52,
   11.56,
   12.64
  ],
  "downbeats": [
   0.04,
   1.64,
   2.46,
   4.88,
   6.72,
   6.84,
   8.66,
   10.52,
   12.64
  ],
  "meter": 2,
  "warp_markers": [
   {
    "seconds": 0.04,
    "beat": 0.0
   },
   {
    "seconds": 0.84,
    "beat": 1.0
   },
   {
    "seconds": 1.64,
    "beat": 2.0
   },
   {
    "seconds": 2.46,
    "beat": 3.0
   },
   {
    "seconds": 4.88,
    "beat": 4.0
   },
   {
    "seconds": 5.92,
    "beat": 5.0
   },
   {
    "seconds": 6.72,
    "beat": 6.0
   },
   {
    "seconds": 6.84,
    "beat": 7.0
   },
   {
    "seconds": 7.66,
    "beat": 8.0
   },
   {
    "seconds": 7.78,
    "beat": 9.0
   },
   {
    "seconds": 8.66,
    "beat": 10.0
   },
   {
    "seconds": 9.58,
    "beat": 11.0
   },
   {
    "seconds": 10.52,
    "beat": 12.0
   },
   {
    "seconds": 11.56,
    "beat": 13.0
   },
   {
    "seconds": 12.64,
    "beat": 14.0
   }
  ],
  "beat_loudness": [
   -27.7,
   -30.9,
   -27.7,
   -23.7,
   -20.2,
   -24.6,
   -24.0,
   -25.3,
   -22.1,
   -27.0,
   -23.5,
   -25.4,
   -18.8,
   -29.1
  ]
 },
 "tonal": {
  "key": {
   "tonic": "Eb",
   "mode": "major",
   "strength": 0.726,
   "camelot": "5B",
   "profile": "temperley"
  },
  "alternatives": [
   {
    "tonic": "Eb",
    "mode": "minor",
    "strength": 0.5318,
    "camelot": "2A",
    "profile": "temperley"
   },
   {
    "tonic": "Ab",
    "mode": "minor",
    "strength": 0.4656,
    "camelot": "1A",
    "profile": "temperley"
   },
   {
    "tonic": "Ab",
    "mode": "major",
    "strength": 0.4649,
    "camelot": "4B",
    "profile": "temperley"
   }
  ],
  "tuning_hz": 440.0,
  "tuning_cents": 0.0,
  "pitch_class_profile": [
   0.3791,
   0.2146,
   0.3715,
   1.0,
   0.3863,
   0.3981,
   0.2669,
   0.4382,
   0.3566,
   0.3518,
   0.6116,
   0.3549
  ],
  "segments": [
   {
    "start": 0.0,
    "end": 14.396,
    "key": {
     "tonic": "Eb",
     "mode": "major",
     "strength": 0.7086,
     "camelot": "5B",
     "profile": "temperley"
    },
    "pitch_class_profile": [
     0.2625,
     0.1541,
     0.3135,
     1.0,
     0.2569,
     0.2844,
     0.185,
     0.3404,
     0.304,
     0.2713,
     0.5816,
     0.2507
    ]
   }
  ],
  "beat_chroma": [
   [
    0.2933,
    0.1725,
    0.2631,
    0.1628,
    0.4947,
    0.5104,
    0.8106,
    1.0,
    0.2081,
    0.2357,
    0.2151,
    0.262
   ],
   [
    0.1861,
    0.1469,
    0.1735,
    0.1186,
    0.7651,
    1.0,
    0.5487,
    0.1411,
    0.1288,
    0.253,
    0.293,
    0.1898
   ],
   [
    0.0831,
    0.0906,
    0.088,
    0.2815,
    1.0,
    0.5846,
    0.114,
    0.0879,
    0.0815,
    0.2708,
    0.1473,
    0.1489
   ],
   [
    0.4431,
    0.4891,
    0.3645,
    0.5579,
    0.9562,
    0.5921,
    0.4886,
    0.4201,
    0.4272,
    0.6772,
    0.4272,
    1.0
   ],
   [
    0.0264,
    0.0446,
    0.1573,
    1.0,
    0.0561,
    0.0484,
    0.027,
    0.0529,
    0.2184,
    0.0516,
    0.2788,
    0.18
   ],
   [
    0.3129,
    0.2038,
    0.3214,
    1.0,
    0.0324,
    0.2382,
    0.2381,
    0.9412,
    0.2009,
    0.1724,
    0.9856,
    0.1335
   ],
   [
    0.4683,
    0.0305,
    0.2338,
    0.1316,
    0.0406,
    0.0938,
    0.3407,
    1.0,
    0.0533,
    0.3038,
    0.0207,
    0.1835
   ],
   [
    1.0,
    0.3354,
    0.1879,
    0.9812,
    0.1371,
    0.3452,
    0.1732,
    0.6795,
    0.4956,
    0.206,
    0.5005,
    0.4295
   ],
   [
    0.0168,
    0.2148,
    0.0234,
    0.5198,
    0.059,
    0.0123,
    0.0277,
    0.0111,
    1.0,
    0.0012,
    0.0438,
    0.0242
   ],
   [
    0.8521,
    0.3434,
    0.3006,
    1.0,
    0.2298,
    0.31,
    0.0994,
    0.8441,
    0.4935,
    0.3704,
    0.339,
    0.3122
   ],
   [
    0.3065,
    0.1063,
    0.7274,
    1.0,
    0.0585,
    0.1933,
    0.1203,
    0.2444,
    0.2899,
    0.5825,
    0.3015,
    0.1643
   ],
   [
    0.9347,
    0.1118,
    0.3687,
    0.5488,
    0.1764,
    0.5017,
    0.2964,
    0.4153,
    0.2109,
    0.2485,
    1.0,
    0.2558
   ],
   [
    0.0319,
    0.0446,
    0.0679,
    1.0,
    0.0086,
    0.0649,
    0.0306,
    0.0674,
    0.2134,
    0.1181,
    0.3852,
    0.0691
   ],
   [
    0.1594,
    0.0635,
    0.6018,
    0.7872,
    0.1027,
    0.223,
    0.0939,
    0.214,
    0.2259,
    0.1799,
    1.0,
    0.0796
   ]
  ],
  "tuning_uncertain": true
 },
 "notes": [
  {
   "start": 4.9484,
   "end": 5.111,
   "midi": 75,
   "velocity": 0.552
  },
  {
   "start": 5.111,
   "end": 5.4941,
   "midi": 63,
   "velocity": 0.43
  },
  {
   "start": 5.111,
   "end": 5.3083,
   "midi": 75,
   "velocity": 0.459
  },
  {
   "start": 5.3083,
   "end": 5.4825,
   "midi": 75,
   "velocity": 0.529
  },
  {
   "start": 5.4825,
   "end": 5.6334,
   "midi": 75,
   "velocity": 0.519
  },
  {
   "start": 5.4941,
   "end": 5.983,
   "midi": 63,
   "velocity": 0.474
  },
  {
   "start": 5.5754,
   "end": 6.0643,
   "midi": 51,
   "velocity": 0.396
  },
  {
   "start": 5.6334,
   "end": 5.7959,
   "midi": 75,
   "velocity": 0.554
  },
  {
   "start": 5.7959,
   "end": 6.0875,
   "midi": 75,
   "velocity": 0.615
  },
  {
   "start": 8.6778,
   "end": 8.8752,
   "midi": 63,
   "velocity": 0.459
  },
  {
   "start": 9.1886,
   "end": 9.3279,
   "midi": 62,
   "velocity": 0.394
  },
  {
   "start": 9.6762,
   "end": 9.8736,
   "midi": 60,
   "velocity": 0.645
  },
  {
   "start": 10.0723,
   "end": 10.2464,
   "midi": 58,
   "velocity": 0.409
  },
  {
   "start": 10.6644,
   "end": 10.9314,
   "midi": 63,
   "velocity": 0.362
  },
  {
   "start": 10.8501,
   "end": 11.3494,
   "midi": 51,
   "velocity": 0.395
  },
  {
   "start": 11.1404,
   "end": 11.5235,
   "midi": 63,
   "velocity": 0.406
  },
  {
   "start": 11.5003,
   "end": 11.6977,
   "midi": 51,
   "velocity": 0.367
  },
  {
   "start": 12.2562,
   "end": 12.442,
   "midi": 58,
   "velocity": 0.412
  },
  {
   "start": 12.442,
   "end": 12.5929,
   "midi": 58,
   "velocity": 0.479
  },
  {
   "start": 12.8367,
   "end": 13.0457,
   "midi": 51,
   "velocity": 0.332
  }
 ],
 "annotations": {
  "markers": [
   {
    "name": "transient",
    "seconds": 5.92,
    "source": "ml"
   }
  ],
  "clips": [
   {
    "name": "shot-1",
    "start": 5.92,
    "end": 6.77,
    "source": "ml",
    "tags": [
     "hit"
    ]
   }
  ]
 }
}
