{
 "apricity_manifest": 2,
 "source": {
  "path": "Waves in F (sound experiment).ogg",
  "sha256": "2caccc008b7be82ad9cbfda0b210b79cafe257a86f9b16a741d8eb80ecc3cf67",
  "sample_rate": 44100,
  "channels": 2,
  "duration": 58.453
 },
 "analysis": {
  "analyzed_at": "2026-09-28T04:42:58+00:00",
  "tools": {
   "apricity-analyze": "0.2.0",
   "essentia": "2.1b6.dev1389",
   "beat_this": "final0",
   "librosa": "1.0.0 (HPSS margin 2.0 before chroma)"
  }
 },
 "rhythm": {
  "bpm": 30.3,
  "bpm_stability": 0.0,
  "beats": [
   17.22,
   18.26,
   19.42,
   20.44,
   22.16,
   30.28,
   33.08,
   39.52,
   42.82,
   48.4,
   50.38,
   52.18
  ],
  "downbeats": [
   17.22,
   19.42,
   22.16,
   30.28,
   33.08,
   39.52,
   42.82,
   48.4,
   50.38,
   52.18
  ],
  "meter": 1,
  "warp_markers": [
   {
    "seconds": 17.22,
    "beat": 0.0
   },
   {
    "seconds": 18.26,
    "beat": 1.0
   },
   {
    "seconds": 19.42,
    "beat": 2.0
   },
   {
    "seconds": 20.44,
    "beat": 3.0
   },
   {
    "seconds": 22.16,
    "beat": 4.0
   },
   {
    "seconds": 30.28,
    "beat": 5.0
   },
   {
    "seconds": 33.08,
    "beat": 6.0
   },
   {
    "seconds": 39.52,
    "beat": 7.0
   },
   {
    "seconds": 42.82,
    "beat": 8.0
   },
   {
    "seconds": 48.4,
    "beat": 9.0
   },
   {
    "seconds": 50.38,
    "beat": 10.0
   },
   {
    "seconds": 52.18,
    "beat": 11.0
   }
  ],
  "beat_loudness": [
   -27.1,
   -28.1,
   -23.6,
   -19.9,
   -26.1,
   -74.9,
   -31.4,
   -18.3,
   -27.7,
   -27.5,
   -24.5
  ],
  "loudness": [
   -180.0,
   -180.0,
   -180.0,
   -71.3,
   -36.8,
   -30.2,
   -30.3,
   -26.5,
   -19.3,
   -17.7,
   -17.5,
   -18.9,
   -23.2,
   -20.7,
   -19.7,
   -18.3,
   -17.6,
   -18.4,
   -22.4,
   -21.2,
   -24.2,
   -28.2,
   -26.2,
   -22.9,
   -26.8,
   -23.8,
   -25.4,
   -21.7,
   -16.8,
   -15.8,
   -14.4,
   -17.5,
   -22.3,
   -26.5,
   -27.2,
   -26.8,
   -27.9,
   -29.4,
   -26.5,
   -23.6,
   -23.5,
   -23.0,
   -20.5,
   -17.9,
   -19.3,
   -20.0,
   -17.6,
   -24.1,
   -32.0,
   -36.8,
   -41.4,
   -44.2,
   -48.2,
   -51.7,
   -55.0,
   -58.4,
   -61.9,
   -65.8,
   -180.0,
   -180.0,
   -70.6,
   -70.8,
   -79.0,
   -180.0,
   -180.0,
   -180.0,
   -49.3,
   -36.7,
   -28.1,
   -27.7,
   -26.4,
   -24.9,
   -34.5,
   -49.1,
   -69.2,
   -180.0,
   -180.0,
   -180.0,
   -96.8,
   -40.9,
   -32.9,
   -22.9,
   -17.3,
   -16.0,
   -15.5,
   -15.6,
   -20.3,
   -25.9,
   -35.5,
   -42.8,
   -50.3,
   -58.2,
   -66.2,
   -180.0,
   -180.0,
   -180.0,
   -62.0,
   -39.8,
   -31.5,
   -24.5,
   -24.3,
   -23.6,
   -24.0,
   -25.8,
   -27.7,
   -32.9,
   -31.4,
   -28.2,
   -35.4,
   -44.5,
   -52.3,
   -62.4,
   -70.9,
   -80.8,
   -90.2,
   -105.3,
   -180.0
  ]
 },
 "tonal": {
  "key": {
   "tonic": "F",
   "mode": "major",
   "strength": 0.6652,
   "camelot": "7B",
   "profile": "temperley"
  },
  "alternatives": [
   {
    "tonic": "Bb",
    "mode": "minor",
    "strength": 0.5443,
    "camelot": "3A",
    "profile": "temperley"
   },
   {
    "tonic": "F",
    "mode": "minor",
    "strength": 0.5182,
    "camelot": "4A",
    "profile": "temperley"
   },
   {
    "tonic": "Bb",
    "mode": "major",
    "strength": 0.5002,
    "camelot": "6B",
    "profile": "temperley"
   }
  ],
  "tuning_hz": 436.2,
  "tuning_cents": -15.0,
  "pitch_class_profile": [
   0.3751,
   0.1271,
   0.1381,
   0.1868,
   0.3291,
   1.0,
   0.1501,
   0.138,
   0.2962,
   0.4272,
   0.4368,
   0.217
  ],
  "segments": [
   {
    "start": 0.0,
    "end": 58.421,
    "key": {
     "tonic": "F",
     "mode": "major",
     "strength": 0.6383,
     "camelot": "7B",
     "profile": "temperley"
    },
    "pitch_class_profile": [
     0.3683,
     0.0907,
     0.1187,
     0.125,
     0.2268,
     1.0,
     0.0936,
     0.0944,
     0.1917,
     0.3927,
     0.3569,
     0.1346
    ]
   }
  ],
  "beat_chroma": [
   [
    1.0,
    0.0099,
    0.2398,
    0.0344,
    0.0072,
    0.3117,
    0.0085,
    0.037,
    0.0252,
    0.9801,
    0.0825,
    0.0078
   ],
   [
    1.0,
    0.0116,
    0.2434,
    0.0203,
    0.0147,
    0.2964,
    0.0083,
    0.0352,
    0.063,
    0.9938,
    0.0382,
    0.0068
   ],
   [
    0.5489,
    0.0718,
    0.0207,
    0.0419,
    0.0013,
    1.0,
    0.0493,
    0.0078,
    0.0753,
    0.0708,
    0.2262,
    0.0137
   ],
   [
    0.4571,
    0.1384,
    0.1128,
    0.3388,
    0.1103,
    1.0,
    0.1062,
    0.0725,
    0.2119,
    0.1248,
    0.3669,
    0.143
   ],
   [
    0.3011,
    0.086,
    0.0867,
    0.2831,
    0.0518,
    1.0,
    0.1804,
    0.0501,
    0.273,
    0.147,
    0.3619,
    0.1294
   ],
   [
    0.7224,
    0.1776,
    0.2021,
    1.0,
    0.1566,
    0.8189,
    0.0864,
    0.0674,
    0.657,
    0.2936,
    0.6151,
    0.4956
   ],
   [
    0.0494,
    0.1191,
    0.0814,
    0.1199,
    0.097,
    1.0,
    0.0899,
    0.1044,
    0.1526,
    0.2128,
    0.3993,
    0.2466
   ],
   [
    0.1614,
    0.1882,
    0.182,
    0.2641,
    0.4265,
    1.0,
    0.2187,
    0.2895,
    0.3072,
    0.3975,
    0.6314,
    0.5002
   ],
   [
    0.1035,
    0.113,
    0.0707,
    0.0898,
    0.8683,
    1.0,
    0.0415,
    0.0987,
    0.1198,
    0.2992,
    0.3626,
    0.1774
   ],
   [
    1.0,
    0.0918,
    0.141,
    0.1386,
    0.0876,
    0.3511,
    0.1982,
    0.2192,
    0.2851,
    0.461,
    0.4974,
    0.2198
   ],
   [
    0.5231,
    0.01,
    0.2571,
    0.0072,
    0.2187,
    0.1484,
    0.0042,
    0.035,
    0.0573,
    1.0,
    0.0406,
    0.0325
   ]
  ]
 },
 "annotations": {
  "clips": [
   {
    "name": "phrase-1",
    "start": 2.031,
    "end": 26.014,
    "source": "ml",
    "tags": [
     "phrase",
     "24.0s"
    ]
   },
   {
    "name": "phrase-2",
    "start": 33.366,
    "end": 36.858,
    "source": "ml",
    "tags": [
     "phrase",
     "3.5s"
    ]
   },
   {
    "name": "phrase-3",
    "start": 39.659,
    "end": 45.176,
    "source": "ml",
    "tags": [
     "phrase",
     "5.5s"
    ]
   },
   {
    "name": "phrase-4",
    "start": 48.523,
    "end": 55.01,
    "source": "ml",
    "tags": [
     "phrase",
     "6.5s"
    ]
   }
  ],
  "markers": []
 }
}
