{
 "apricity_manifest": 2,
 "source": {
  "path": "hihatOpen_OH_F_1.wav",
  "sha256": "7493fce31fb00093e4944f878a7fe802177a5c311e82725ac0ce7956e86f2fdc",
  "sample_rate": 48000,
  "channels": 2,
  "duration": 8.87
 },
 "analysis": {
  "analyzed_at": "2026-09-24T21:30:12+00:00",
  "tools": {
   "apricity-analyze": "0.2.0",
   "essentia": "2.1b6.dev1389",
   "beat_this": "final0",
   "librosa": "1.0.0 (HPSS margin 2.0 before chroma)"
  }
 },
 "rhythm": {
  "bpm": null,
  "bpm_stability": 0.0,
  "beats": [],
  "downbeats": [],
  "meter": null,
  "warp_markers": [],
  "beat_loudness": [],
  "loudness": [
   -22.0,
   -30.0,
   -31.9,
   -33.8,
   -36.8,
   -38.8,
   -42.3,
   -43.5,
   -46.1,
   -48.4,
   -50.7,
   -53.6,
   -56.7,
   -60.6,
   -63.0,
   -67.1,
   -74.4,
   -83.0
  ]
 },
 "tonal": {
  "key": {
   "tonic": "F",
   "mode": "major",
   "strength": 0.6194,
   "camelot": "7B",
   "profile": "temperley"
  },
  "alternatives": [
   {
    "tonic": "A",
    "mode": "minor",
    "strength": 0.5679,
    "camelot": "8A",
    "profile": "temperley"
   },
   {
    "tonic": "G",
    "mode": "minor",
    "strength": 0.3775,
    "camelot": "6A",
    "profile": "temperley"
   },
   {
    "tonic": "Bb",
    "mode": "major",
    "strength": 0.3575,
    "camelot": "6B",
    "profile": "temperley"
   }
  ],
  "tuning_hz": 440.0,
  "tuning_cents": 0.0,
  "pitch_class_profile": [
   0.795,
   0.0566,
   0.4351,
   0.2649,
   0.1204,
   0.3288,
   0.2796,
   0.218,
   0.1787,
   1.0,
   0.2602,
   0.2765
  ],
  "segments": [
   {
    "start": 0.0,
    "end": 8.824,
    "key": {
     "tonic": "F",
     "mode": "major",
     "strength": 0.6198,
     "camelot": "7B",
     "profile": "temperley"
    },
    "pitch_class_profile": [
     0.7994,
     0.0569,
     0.4362,
     0.2664,
     0.1211,
     0.3304,
     0.2812,
     0.2191,
     0.1797,
     1.0,
     0.2617,
     0.278
    ]
   }
  ],
  "beat_chroma": [],
  "tuning_uncertain": true
 },
 "annotations": {
  "clips": [],
  "markers": []
 }
}
