{
 "apricity_manifest": 2,
 "source": {
  "path": "announcer.wav",
  "sha256": "b05c3db7d0f08ccc8dd4c9546b6cadc1d25b4b23e5e4b939272fbc06f9cd8e6b",
  "sample_rate": 24000,
  "channels": 1,
  "duration": 18.675
 },
 "analysis": {
  "analyzed_at": "2026-09-26T17:28:04+00:00",
  "tools": {
   "apricity-analyze": "0.2.0",
   "essentia": "2.1b6.dev1389",
   "beat_this": "final0",
   "librosa": "1.0.0 (HPSS margin 2.0 before chroma)",
   "basic-pitch": "0.4.0"
  }
 },
 "rhythm": {
  "bpm": 93.75,
  "bpm_stability": 1.0,
  "beats": [
   0.28,
   0.92
  ],
  "downbeats": [],
  "meter": null,
  "warp_markers": [
   {
    "seconds": 0.28,
    "beat": 0.0
   },
   {
    "seconds": 0.92,
    "beat": 1.0
   }
  ],
  "beat_loudness": [
   -19.5
  ],
  "loudness": [
   -20.5,
   -20.1,
   -25.0,
   -96.9,
   -180.0,
   -19.7,
   -22.1,
   -21.0,
   -25.3,
   -97.6,
   -180.0,
   -19.8,
   -20.2,
   -21.0,
   -23.1,
   -31.8,
   -98.8,
   -180.0,
   -20.1,
   -40.2,
   -180.0,
   -19.7,
   -39.4,
   -180.0,
   -20.0,
   -21.5,
   -68.2,
   -180.0,
   -20.8,
   -19.7,
   -33.0,
   -180.0,
   -23.8,
   -19.4,
   -23.4,
   -21.3,
   -53.9,
   -180.0
  ]
 },
 "tonal": {
  "key": {
   "tonic": "Gb",
   "mode": "minor",
   "strength": 0.3883,
   "camelot": "11A",
   "profile": "temperley"
  },
  "alternatives": [
   {
    "tonic": "G",
    "mode": "major",
    "strength": 0.3268,
    "camelot": "9B",
    "profile": "temperley"
   },
   {
    "tonic": "A",
    "mode": "major",
    "strength": 0.2706,
    "camelot": "11B",
    "profile": "temperley"
   },
   {
    "tonic": "D",
    "mode": "major",
    "strength": 0.1851,
    "camelot": "10B",
    "profile": "temperley"
   }
  ],
  "tuning_hz": 440.0,
  "tuning_cents": 0.0,
  "pitch_class_profile": [
   0.8985,
   0.9798,
   0.901,
   0.5975,
   0.5373,
   0.4707,
   0.6784,
   0.8529,
   1.0,
   0.8796,
   0.7212,
   0.9234
  ],
  "segments": [
   {
    "start": 0.0,
    "end": 12.0,
    "key": {
     "tonic": "G",
     "mode": "major",
     "strength": 0.4172,
     "camelot": "9B",
     "profile": "temperley"
    },
    "pitch_class_profile": [
     0.9886,
     0.9717,
     0.8439,
     0.6074,
     0.5232,
     0.4959,
     0.6822,
     0.9179,
     0.9263,
     0.8658,
     0.7156,
     1.0
    ]
   },
   {
    "start": 12.0,
    "end": 18.669,
    "key": {
     "tonic": "Gb",
     "mode": "minor",
     "strength": 0.4765,
     "camelot": "11A",
     "profile": "temperley"
    },
    "pitch_class_profile": [
     0.6797,
     0.89,
     0.8879,
     0.522,
     0.5016,
     0.3869,
     0.603,
     0.674,
     1.0,
     0.8081,
     0.6545,
     0.7209
    ]
   }
  ],
  "beat_chroma": [
   [
    0.4841,
    1.0,
    0.6476,
    0.3841,
    0.2916,
    0.2672,
    0.2872,
    0.3987,
    0.6153,
    0.5932,
    0.4073,
    0.5247
   ]
  ],
  "tuning_uncertain": true
 },
 "notes": [
  {
   "start": 0.4876,
   "end": 0.6502,
   "midi": 49,
   "velocity": 0.496
  },
  {
   "start": 2.8225,
   "end": 2.985,
   "midi": 49,
   "velocity": 0.462
  },
  {
   "start": 3.5888,
   "end": 3.7513,
   "midi": 45,
   "velocity": 0.417
  },
  {
   "start": 3.7745,
   "end": 3.9255,
   "midi": 48,
   "velocity": 0.339
  },
  {
   "start": 5.8192,
   "end": 6.1223,
   "midi": 48,
   "velocity": 0.393
  },
  {
   "start": 6.7028,
   "end": 6.8537,
   "midi": 46,
   "velocity": 0.554
  },
  {
   "start": 6.8305,
   "end": 6.9814,
   "midi": 44,
   "velocity": 0.413
  },
  {
   "start": 10.6063,
   "end": 10.7456,
   "midi": 50,
   "velocity": 0.297
  },
  {
   "start": 16.4384,
   "end": 16.6241,
   "midi": 49,
   "velocity": 0.363
  },
  {
   "start": 16.926,
   "end": 17.1234,
   "midi": 45,
   "velocity": 0.396
  }
 ],
 "annotations": {
  "markers": [
   {
    "name": "transient",
    "seconds": 4.0,
    "source": "ml"
   },
   {
    "name": "transient",
    "seconds": 12.151,
    "source": "ml"
   }
  ],
  "clips": [
   {
    "name": "phrase-1",
    "start": 0.237,
    "end": 1.505,
    "source": "ml",
    "tags": [
     "phrase",
     "1.3s"
    ]
   },
   {
    "name": "phrase-2",
    "start": 2.693,
    "end": 4.42,
    "source": "ml",
    "tags": [
     "phrase",
     "1.7s"
    ]
   },
   {
    "name": "phrase-3",
    "start": 5.612,
    "end": 7.827,
    "source": "ml",
    "tags": [
     "phrase",
     "2.2s"
    ]
   },
   {
    "name": "phrase-4",
    "start": 9.043,
    "end": 9.627,
    "source": "ml",
    "tags": [
     "phrase",
     "0.6s"
    ]
   },
   {
    "name": "phrase-5",
    "start": 10.547,
    "end": 11.136,
    "source": "ml",
    "tags": [
     "phrase",
     "0.6s"
    ]
   },
   {
    "name": "phrase-6",
    "start": 12.114,
    "end": 13.069,
    "source": "ml",
    "tags": [
     "phrase",
     "1.0s"
    ]
   },
   {
    "name": "phrase-7",
    "start": 14.21,
    "end": 15.223,
    "source": "ml",
    "tags": [
     "phrase",
     "1.0s"
    ]
   },
   {
    "name": "phrase-8",
    "start": 16.363,
    "end": 18.108,
    "source": "ml",
    "tags": [
     "phrase",
     "1.7s"
    ]
   },
   {
    "name": "shot-1",
    "start": 4.0,
    "end": 4.64,
    "source": "ml",
    "tags": [
     "shot"
    ],
    "evidence": {
     "standout": 13093124096.0
    }
   },
   {
    "name": "shot-2",
    "start": 12.151,
    "end": 12.791,
    "source": "ml",
    "tags": [
     "shot"
    ],
    "evidence": {
     "standout": 22523103232.0
    }
   }
  ]
 }
}
