{
 "apricity_manifest": 2,
 "source": {
  "path": "hihatFoot_OH_MP_1.wav",
  "sha256": "2ad5e1bc38e5b9984d923b278b8ec5488540366082f4de9401d4702b9ba95e4c",
  "sample_rate": 48000,
  "channels": 2,
  "duration": 1.328
 },
 "analysis": {
  "analyzed_at": "2026-09-24T21:30:12+00:00",
  "tools": {
   "apricity-analyze": "0.2.0",
   "essentia": "2.1b6.dev1389",
   "beat_this": "final0",
   "librosa": "1.0.0 (HPSS margin 2.0 before chroma)"
  }
 },
 "rhythm": {
  "bpm": null,
  "bpm_stability": 0.0,
  "beats": [],
  "downbeats": [],
  "meter": null,
  "warp_markers": [],
  "beat_loudness": [],
  "loudness": [
   -22.8,
   -73.7,
   -79.3
  ]
 },
 "tonal": {
  "key": {
   "tonic": "F",
   "mode": "minor",
   "strength": 0.5643,
   "camelot": "4A",
   "profile": "temperley"
  },
  "alternatives": [
   {
    "tonic": "G",
    "mode": "minor",
    "strength": 0.4517,
    "camelot": "6A",
    "profile": "temperley"
   },
   {
    "tonic": "F",
    "mode": "major",
    "strength": 0.4469,
    "camelot": "7B",
    "profile": "temperley"
   },
   {
    "tonic": "C",
    "mode": "major",
    "strength": 0.4044,
    "camelot": "8B",
    "profile": "temperley"
   }
  ],
  "tuning_hz": 440.0,
  "tuning_cents": 0.0,
  "pitch_class_profile": [
   1.0,
   0.6744,
   0.6458,
   0.3395,
   0.7114,
   0.5014,
   0.4322,
   0.8607,
   0.381,
   0.2583,
   0.8694,
   0.1226
  ],
  "segments": [
   {
    "start": 0.0,
    "end": 1.3,
    "key": {
     "tonic": "F",
     "mode": "minor",
     "strength": 0.5643,
     "camelot": "4A",
     "profile": "temperley"
    },
    "pitch_class_profile": [
     1.0,
     0.6744,
     0.6458,
     0.3395,
     0.7114,
     0.5014,
     0.4322,
     0.8607,
     0.381,
     0.2583,
     0.8694,
     0.1226
    ]
   }
  ],
  "beat_chroma": [],
  "tuning_uncertain": true
 },
 "annotations": {
  "clips": [],
  "markers": []
 }
}
