{
 "apricity_manifest": 2,
 "source": {
  "path": "True-to-the-flag-march_00694039_002_00-02-43.clean.wav",
  "sha256": "7653c2a599ee54a150ae80e3d0d4a9a5a9672df60d78522928f636416cc1f334",
  "sample_rate": 48000,
  "channels": 2,
  "duration": 7.407,
  "denoise": {
   "backend": "neural",
   "strength": "medium",
   "original": "True-to-the-flag-march_00694039_002_00-02-43.wav"
  }
 },
 "analysis": {
  "analyzed_at": "2026-09-26T17:58:16+00:00",
  "tools": {
   "apricity-analyze": "0.2.0",
   "essentia": "2.1b6.dev1389",
   "beat_this": "final0",
   "librosa": "1.0.0 (HPSS margin 2.0 before chroma)",
   "basic-pitch": "0.4.0"
  }
 },
 "rhythm": {
  "bpm": 130.43,
  "bpm_stability": 0.971,
  "beats": [
   0.02,
   0.48,
   0.94,
   1.4,
   1.88,
   2.34,
   2.8,
   3.26,
   3.74,
   4.22,
   4.68,
   5.14,
   5.58,
   6.06,
   6.52,
   6.96,
   7.4
  ],
  "downbeats": [
   0.48,
   1.4,
   2.34,
   3.26,
   3.74,
   4.22,
   4.68,
   5.14,
   5.58,
   6.06,
   7.4
  ],
  "meter": 1,
  "warp_markers": [
   {
    "seconds": 0.02,
    "beat": -1.0
   },
   {
    "seconds": 0.48,
    "beat": 0.0
   },
   {
    "seconds": 0.94,
    "beat": 1.0
   },
   {
    "seconds": 1.4,
    "beat": 2.0
   },
   {
    "seconds": 1.88,
    "beat": 3.0
   },
   {
    "seconds": 2.34,
    "beat": 4.0
   },
   {
    "seconds": 2.8,
    "beat": 5.0
   },
   {
    "seconds": 3.26,
    "beat": 6.0
   },
   {
    "seconds": 3.74,
    "beat": 7.0
   },
   {
    "seconds": 4.22,
    "beat": 8.0
   },
   {
    "seconds": 4.68,
    "beat": 9.0
   },
   {
    "seconds": 5.14,
    "beat": 10.0
   },
   {
    "seconds": 5.58,
    "beat": 11.0
   },
   {
    "seconds": 6.06,
    "beat": 12.0
   },
   {
    "seconds": 6.52,
    "beat": 13.0
   },
   {
    "seconds": 6.96,
    "beat": 14.0
   },
   {
    "seconds": 7.4,
    "beat": 15.0
   }
  ],
  "beat_loudness": [
   -22.2,
   -30.1,
   -25.5,
   -30.0,
   -25.2,
   -25.3,
   -27.6,
   -29.0,
   -28.9,
   -29.3,
   -28.8,
   -30.8,
   -30.9,
   -25.3,
   -31.7,
   -33.7
  ],
  "loudness": [
   -22.4,
   -26.3,
   -28.7,
   -28.9,
   -25.2,
   -24.8,
   -29.5,
   -30.4,
   -28.8,
   -28.7,
   -31.0,
   -31.0,
   -25.9,
   -31.1,
   -33.6
  ]
 },
 "tonal": {
  "key": {
   "tonic": "Eb",
   "mode": "major",
   "strength": 0.8632,
   "camelot": "5B",
   "profile": "temperley"
  },
  "alternatives": [
   {
    "tonic": "Bb",
    "mode": "major",
    "strength": 0.717,
    "camelot": "6B",
    "profile": "temperley"
   },
   {
    "tonic": "Ab",
    "mode": "major",
    "strength": 0.6038,
    "camelot": "4B",
    "profile": "temperley"
   },
   {
    "tonic": "Eb",
    "mode": "minor",
    "strength": 0.5707,
    "camelot": "2A",
    "profile": "temperley"
   }
  ],
  "tuning_hz": 433.82,
  "tuning_cents": -24.5,
  "pitch_class_profile": [
   0.5679,
   0.2271,
   0.4067,
   0.7014,
   0.2622,
   0.6425,
   0.2594,
   0.4753,
   0.5264,
   0.3053,
   1.0,
   0.2907
  ],
  "segments": [
   {
    "start": 0.0,
    "end": 7.384,
    "key": {
     "tonic": "Eb",
     "mode": "major",
     "strength": 0.8005,
     "camelot": "5B",
     "profile": "temperley"
    },
    "pitch_class_profile": [
     0.5365,
     0.2349,
     0.4513,
     0.7626,
     0.2606,
     0.5891,
     0.2351,
     0.5177,
     0.4963,
     0.2782,
     1.0,
     0.2681
    ]
   }
  ],
  "beat_chroma": [
   [
    0.2572,
    0.0639,
    0.1185,
    0.1953,
    0.9528,
    0.1205,
    0.0542,
    1.0,
    0.0545,
    0.2515,
    0.5465,
    0.9349
   ],
   [
    0.4228,
    0.1893,
    0.0772,
    0.4421,
    0.5223,
    0.8493,
    0.1004,
    0.6183,
    0.5595,
    0.1686,
    1.0,
    0.3882
   ],
   [
    0.2489,
    0.2833,
    0.0358,
    0.2542,
    0.1365,
    0.2813,
    0.1482,
    0.0437,
    1.0,
    0.0427,
    0.6282,
    0.396
   ],
   [
    0.4316,
    0.2367,
    0.0464,
    0.4784,
    0.0773,
    0.3681,
    0.1104,
    0.1181,
    1.0,
    0.1261,
    0.6879,
    0.038
   ],
   [
    1.0,
    0.2263,
    0.2623,
    0.0202,
    0.166,
    0.2711,
    0.5397,
    0.0595,
    0.1189,
    0.885,
    0.0515,
    0.2028
   ],
   [
    0.8225,
    0.255,
    0.5029,
    0.2664,
    0.0975,
    0.5339,
    0.2068,
    0.3793,
    0.0834,
    0.3747,
    1.0,
    0.2551
   ],
   [
    0.1457,
    0.0426,
    0.3159,
    0.2458,
    0.0286,
    0.5132,
    0.0595,
    0.2077,
    0.0937,
    0.0095,
    1.0,
    0.0084
   ],
   [
    0.4596,
    0.1311,
    0.0165,
    1.0,
    0.0372,
    0.7009,
    0.0149,
    0.0486,
    0.5308,
    0.0069,
    0.1771,
    0.0519
   ],
   [
    0.4574,
    0.042,
    0.2156,
    1.0,
    0.1895,
    0.2691,
    0.9475,
    0.0517,
    0.2689,
    0.7249,
    0.1627,
    0.305
   ],
   [
    0.1648,
    0.0492,
    0.1695,
    0.7,
    0.0245,
    0.4324,
    0.0678,
    0.5527,
    0.1436,
    0.0587,
    1.0,
    0.0306
   ],
   [
    0.3498,
    0.0448,
    0.6362,
    0.3202,
    0.0195,
    0.7354,
    0.0455,
    0.4448,
    0.0645,
    0.112,
    1.0,
    0.0112
   ],
   [
    0.1986,
    0.297,
    0.6187,
    0.2124,
    0.1281,
    0.6778,
    0.1039,
    0.1868,
    0.5946,
    0.1415,
    1.0,
    0.1573
   ],
   [
    0.0856,
    0.0824,
    0.6495,
    0.2195,
    0.0404,
    0.6382,
    0.0658,
    0.1955,
    0.1847,
    0.0286,
    1.0,
    0.0212
   ],
   [
    0.1,
    0.0924,
    0.2543,
    1.0,
    0.1045,
    0.0959,
    0.0704,
    0.3734,
    0.2221,
    0.0295,
    0.8831,
    0.1489
   ],
   [
    0.5833,
    0.1474,
    0.1557,
    0.8719,
    0.3405,
    0.3533,
    0.1579,
    1.0,
    0.3174,
    0.2979,
    0.6024,
    0.2002
   ],
   [
    1.0,
    0.4643,
    0.4329,
    0.5866,
    0.3586,
    0.3317,
    0.2906,
    0.3685,
    0.6548,
    0.3948,
    0.2716,
    0.3326
   ]
  ]
 },
 "notes": [
  {
   "start": 0.952,
   "end": 1.1494,
   "midi": 68,
   "velocity": 0.289
  },
  {
   "start": 2.7993,
   "end": 3.1011,
   "midi": 70,
   "velocity": 0.357
  },
  {
   "start": 3.3333,
   "end": 3.6352,
   "midi": 75,
   "velocity": 0.502
  },
  {
   "start": 3.7861,
   "end": 4.1009,
   "midi": 75,
   "velocity": 0.357
  },
  {
   "start": 4.1009,
   "end": 4.2634,
   "midi": 75,
   "velocity": 0.442
  },
  {
   "start": 4.2054,
   "end": 4.3795,
   "midi": 58,
   "velocity": 0.496
  },
  {
   "start": 6.3777,
   "end": 6.517,
   "midi": 75,
   "velocity": 0.326
  }
 ],
 "annotations": {
  "clips": [
   {
    "name": "loop-1",
    "start": 1.4,
    "end": 3.26,
    "source": "ml",
    "tags": [
     "loop",
     "4beats",
     "Bb"
    ],
    "evidence": {
     "repeat": 0.269,
     "steady": 0.981,
     "static": 0.836,
     "level_db": -1.8
    }
   },
   {
    "name": "loop-2",
    "start": 3.26,
    "end": 5.14,
    "source": "ml",
    "tags": [
     "loop",
     "4beats",
     "Eb"
    ],
    "evidence": {
     "repeat": -0.003,
     "steady": 0.979,
     "static": 0.846,
     "level_db": -3.8
    }
   },
   {
    "name": "shot-1",
    "start": 0.018,
    "end": 0.478,
    "source": "ml",
    "tags": [
     "shot"
    ],
    "evidence": {
     "standout": 11.8
    }
   },
   {
    "name": "shot-2",
    "start": 4.43,
    "end": 4.89,
    "source": "ml",
    "tags": [
     "shot"
    ],
    "evidence": {
     "standout": 6.8
    }
   }
  ],
  "markers": [
   {
    "name": "transient",
    "seconds": 0.018,
    "source": "ml"
   },
   {
    "name": "transient",
    "seconds": 4.43,
    "source": "ml"
   }
  ]
 }
}
